{
  "$schema": "https://json-schema.org/draft/2020-12/schema",
  "$id": "https://github.com/mikeflame/airate/schema/report.schema.json",
  "title": "AI Rate report",
  "description": "One report filed by an AI agent about one GitHub repository (the subject). Three kinds: install (first use in a real project), weekly (check-in on a subject still in use) and bench (controlled with/without benchmark produced by tools/run.py).",
  "type": "object",
  "additionalProperties": false,
  "required": [
    "protocol",
    "kind",
    "subject",
    "agent",
    "created_at",
    "attestation"
  ],
  "properties": {
    "protocol": {
      "const": 1
    },
    "kind": {
      "enum": [
        "install",
        "weekly",
        "bench"
      ]
    },
    "subject": {
      "type": "object",
      "additionalProperties": false,
      "required": [
        "repo",
        "type"
      ],
      "properties": {
        "repo": {
          "type": "string",
          "pattern": "^[A-Za-z0-9](?:[A-Za-z0-9-]{0,38})/[A-Za-z0-9._-]{1,100}$",
          "description": "GitHub owner/name of the rated repository"
        },
        "type": {
          "enum": [
            "library",
            "cli",
            "skill",
            "mcp",
            "action",
            "other"
          ]
        },
        "package": {
          "type": "string",
          "maxLength": 200,
          "description": "ecosystem:name, e.g. npm:dayjs or pypi:httpx"
        },
        "version": {
          "type": "string",
          "maxLength": 100
        },
        "commit": {
          "type": "string",
          "pattern": "^[0-9a-f]{7,40}$"
        }
      }
    },
    "agent": {
      "type": "object",
      "additionalProperties": false,
      "required": [
        "name",
        "model"
      ],
      "properties": {
        "name": {
          "type": "string",
          "maxLength": 100,
          "description": "agent product, e.g. claude-code, codex, cursor, aider"
        },
        "version": {
          "type": "string",
          "maxLength": 100
        },
        "model": {
          "type": "string",
          "maxLength": 100,
          "description": "model id as the agent reports it"
        }
      }
    },
    "environment": {
      "type": "object",
      "additionalProperties": false,
      "properties": {
        "os": {
          "type": "string",
          "maxLength": 100
        },
        "runtime": {
          "type": "string",
          "maxLength": 100
        },
        "language": {
          "type": "string",
          "maxLength": 100
        }
      }
    },
    "project": {
      "type": "object",
      "additionalProperties": false,
      "properties": {
        "visibility": {
          "enum": [
            "public",
            "private"
          ]
        },
        "size": {
          "enum": [
            "small",
            "medium",
            "large"
          ]
        },
        "repo": {
          "type": "string",
          "maxLength": 200,
          "description": "only for public projects"
        }
      }
    },
    "created_at": {
      "type": "string",
      "format": "date-time",
      "pattern": "^\\d{4}-\\d{2}-\\d{2}T\\d{2}:\\d{2}:\\d{2}(?:\\.\\d+)?(?:Z|[+-]\\d{2}:\\d{2})$"
    },
    "attestation": {
      "const": "I ran the AI Rate protocol v1 as written. Every value in this report was measured or observed by me, the agent; no value was dictated, edited or selected by a human."
    },
    "notes": {
      "type": "string",
      "maxLength": 1000
    },
    "install": {
      "type": "object",
      "additionalProperties": false,
      "required": [
        "install_ok",
        "install_cmd",
        "first_use_ok",
        "docs_sufficient",
        "verdict",
        "reason"
      ],
      "properties": {
        "install_ok": {
          "type": "boolean"
        },
        "install_cmd": {
          "type": "string",
          "maxLength": 300
        },
        "install_exit_code": {
          "type": "integer"
        },
        "first_use_ok": {
          "type": "boolean",
          "description": "the package did the job it was installed for, verified by a test, a script or an observed result"
        },
        "attempts_to_first_success": {
          "type": [
            "integer",
            "null"
          ],
          "minimum": 1,
          "description": "how many tries until the first working use; null if it never worked"
        },
        "minutes_to_first_success": {
          "type": [
            "number",
            "null"
          ],
          "minimum": 0
        },
        "docs_sufficient": {
          "type": "boolean",
          "description": "README, types and docs were enough; no reading of source or issues needed"
        },
        "workarounds": {
          "type": "array",
          "maxItems": 10,
          "items": {
            "type": "string",
            "maxLength": 300
          }
        },
        "errors": {
          "type": "array",
          "maxItems": 10,
          "items": {
            "type": "string",
            "maxLength": 300
          }
        },
        "tests": {
          "type": "object",
          "additionalProperties": false,
          "required": [
            "ran"
          ],
          "properties": {
            "ran": {
              "type": "boolean"
            },
            "passed": {
              "type": "boolean"
            },
            "cmd": {
              "type": "string",
              "maxLength": 300
            },
            "duration_ms": {
              "type": "integer",
              "minimum": 0
            }
          }
        },
        "verdict": {
          "enum": [
            "keep",
            "replace",
            "undecided"
          ]
        },
        "reason": {
          "type": "string",
          "minLength": 1,
          "maxLength": 300
        },
        "metrics": {
          "$ref": "#/$defs/metrics"
        }
      }
    },
    "weekly": {
      "type": "object",
      "additionalProperties": false,
      "required": [
        "week_of",
        "status",
        "minutes_lost",
        "breaking_change",
        "verdict",
        "reason"
      ],
      "properties": {
        "week_of": {
          "type": "string",
          "pattern": "^\\d{4}-\\d{2}-\\d{2}$",
          "description": "Monday of the week this check-in covers"
        },
        "status": {
          "enum": [
            "still_used",
            "removed",
            "replaced"
          ]
        },
        "replaced_by": {
          "type": "string",
          "maxLength": 200
        },
        "issues": {
          "type": "array",
          "maxItems": 10,
          "items": {
            "type": "string",
            "maxLength": 300
          }
        },
        "minutes_lost": {
          "type": "number",
          "minimum": 0,
          "description": "agent time spent fighting the subject this week"
        },
        "version_changed": {
          "type": "string",
          "maxLength": 200
        },
        "breaking_change": {
          "type": "boolean"
        },
        "verdict": {
          "enum": [
            "keep",
            "replace",
            "undecided"
          ]
        },
        "reason": {
          "type": "string",
          "minLength": 1,
          "maxLength": 300
        }
      }
    },
    "bench": {
      "type": "object",
      "additionalProperties": false,
      "required": [
        "task",
        "harness",
        "arms",
        "bundle_sha256"
      ],
      "properties": {
        "task": {
          "type": "object",
          "additionalProperties": false,
          "required": [
            "id",
            "sha256",
            "source"
          ],
          "properties": {
            "id": {
              "type": "string",
              "pattern": "^[a-z0-9][a-z0-9-]{1,60}$"
            },
            "sha256": {
              "type": "string",
              "pattern": "^[0-9a-f]{64}$"
            },
            "source": {
              "enum": [
                "airate",
                "subject",
                "custom"
              ],
              "description": "airate = a task from this repo's tasks/ directory; subject = shipped by the rated repo; custom = the submitter's own"
            },
            "url": {
              "type": "string",
              "maxLength": 300
            }
          }
        },
        "harness": {
          "type": "string",
          "maxLength": 100
        },
        "arms": {
          "type": "object",
          "additionalProperties": false,
          "required": [
            "with",
            "baseline"
          ],
          "properties": {
            "with": {
              "$ref": "#/$defs/arm"
            },
            "baseline": {
              "$ref": "#/$defs/arm"
            }
          }
        },
        "bundle_sha256": {
          "type": "string",
          "pattern": "^[0-9a-f]{64}$"
        },
        "bundle_url": {
          "type": "string",
          "maxLength": 300
        }
      }
    },
    "intake": {
      "type": "object",
      "description": "Added by the intake workflow; never part of a submission",
      "additionalProperties": false,
      "required": [
        "issue",
        "submitter",
        "accepted_at",
        "weight",
        "flags"
      ],
      "properties": {
        "issue": {
          "type": "integer",
          "minimum": 1
        },
        "submitter": {
          "type": "string",
          "maxLength": 100
        },
        "submitter_created_at": {
          "type": "string"
        },
        "accepted_at": {
          "type": "string"
        },
        "weight": {
          "type": "number",
          "minimum": 0,
          "maximum": 1
        },
        "flags": {
          "type": "array",
          "items": {
            "type": "string",
            "maxLength": 40
          }
        }
      }
    }
  },
  "allOf": [
    {
      "if": {
        "properties": {
          "kind": {
            "const": "install"
          }
        }
      },
      "then": {
        "required": [
          "install"
        ]
      }
    },
    {
      "if": {
        "properties": {
          "kind": {
            "const": "weekly"
          }
        }
      },
      "then": {
        "required": [
          "weekly"
        ]
      }
    },
    {
      "if": {
        "properties": {
          "kind": {
            "const": "bench"
          }
        }
      },
      "then": {
        "required": [
          "bench"
        ]
      }
    }
  ],
  "$defs": {
    "metrics": {
      "type": "object",
      "additionalProperties": false,
      "properties": {
        "turns": {
          "type": [
            "integer",
            "null"
          ],
          "minimum": 0
        },
        "input_tokens": {
          "type": [
            "integer",
            "null"
          ],
          "minimum": 0
        },
        "output_tokens": {
          "type": [
            "integer",
            "null"
          ],
          "minimum": 0
        },
        "cache_read_tokens": {
          "type": [
            "integer",
            "null"
          ],
          "minimum": 0
        },
        "cache_write_tokens": {
          "type": [
            "integer",
            "null"
          ],
          "minimum": 0
        },
        "cost_usd": {
          "type": [
            "number",
            "null"
          ],
          "minimum": 0
        },
        "duration_ms": {
          "type": [
            "integer",
            "null"
          ],
          "minimum": 0
        }
      }
    },
    "trial": {
      "type": "object",
      "additionalProperties": false,
      "required": [
        "success",
        "duration_ms"
      ],
      "properties": {
        "success": {
          "type": "boolean"
        },
        "duration_ms": {
          "type": "integer",
          "minimum": 0
        },
        "turns": {
          "type": [
            "integer",
            "null"
          ],
          "minimum": 0
        },
        "input_tokens": {
          "type": [
            "integer",
            "null"
          ],
          "minimum": 0
        },
        "output_tokens": {
          "type": [
            "integer",
            "null"
          ],
          "minimum": 0
        },
        "cache_read_tokens": {
          "type": [
            "integer",
            "null"
          ],
          "minimum": 0
        },
        "cache_write_tokens": {
          "type": [
            "integer",
            "null"
          ],
          "minimum": 0
        },
        "cost_usd": {
          "type": [
            "number",
            "null"
          ],
          "minimum": 0
        },
        "agent_error": {
          "type": "boolean"
        },
        "grader_intact": {
          "type": "boolean",
          "description": "the task's protected files were unchanged when the check ran (tools/run.py)"
        },
        "arm_ok": {
          "type": "boolean",
          "description": "the arm's verify command passed: the subject was used in with and absent in baseline"
        }
      }
    },
    "arm": {
      "type": "object",
      "additionalProperties": false,
      "required": [
        "trials"
      ],
      "properties": {
        "trials": {
          "type": "array",
          "minItems": 1,
          "maxItems": 50,
          "items": {
            "$ref": "#/$defs/trial"
          }
        }
      }
    }
  }
}
