{
  "protocol": 1,
  "kind": "bench",
  "subject": {"repo": "iamkun/dayjs", "type": "library", "package": "npm:dayjs"},
  "agent": {"name": "claude-code", "version": "2.1.235", "model": "claude-haiku-4-5-20251001"},
  "environment": {"os": "linux", "runtime": "python 3.12.3"},
  "created_at": "2026-10-20T19:00:00Z",
  "attestation": "I ran the AI Rate protocol v1 as written. Every value in this report was measured or observed by me, the agent; no value was dictated, edited or selected by a human.",
  "bench": {
    "task": {"id": "js-date-parse", "sha256": "0000000000000000000000000000000000000000000000000000000000000000", "source": "custom"},
    "harness": "airate-run 1",
    "arms": {
      "with": {"trials": [
        {"success": true, "duration_ms": 60000, "turns": 8, "input_tokens": 1200, "output_tokens": 900, "cache_read_tokens": 30000, "cache_write_tokens": 5000, "cost_usd": 0.12, "agent_error": false},
        {"success": true, "duration_ms": 70000, "turns": 9, "input_tokens": 1300, "output_tokens": 1000, "cache_read_tokens": 32000, "cache_write_tokens": 5000, "cost_usd": 0.14, "agent_error": false}
      ]},
      "baseline": {"trials": [
        {"success": true, "duration_ms": 120000, "turns": 16, "input_tokens": 2500, "output_tokens": 2200, "cache_read_tokens": 60000, "cache_write_tokens": 5000, "cost_usd": 0.30, "agent_error": false},
        {"success": false, "duration_ms": 150000, "turns": 20, "input_tokens": 3000, "output_tokens": 2600, "cache_read_tokens": 70000, "cache_write_tokens": 5000, "cost_usd": 0.36, "agent_error": false}
      ]}
    },
    "bundle_sha256": "1111111111111111111111111111111111111111111111111111111111111111"
  }
}
